{
  "$schema": "https://json-schema.org/draft/2020-12/schema",
  "$id": "https://overkill-factory.dev/schemas/production-readiness-plan.schema.json",
  "title": "Overkill Factory Production Readiness Plan",
  "type": "object",
  "required": [
    "$schema",
    "gate_enforcement",
    "release_owner",
    "release_path",
    "rollback_path",
    "health_checks",
    "monitoring_signals",
    "release_approval_rule",
    "support_handoff",
    "incident_owner",
    "production_promotion_ladder_ref",
    "evidence_refs"
  ],
  "properties": {
    "$schema": {
      "const": "https://overkill-factory.dev/schemas/production-readiness-plan.schema.json"
    },
    "gate_enforcement": {
      "enum": ["strict", "production"]
    },
    "release_owner": {
      "type": "string",
      "minLength": 3
    },
    "release_path": {
      "type": "object",
      "required": ["release_channel", "release_artifact_ref", "pre_release_smoke_ref", "approval_rule_ref"],
      "properties": {
        "release_channel": { "type": "string", "minLength": 3 },
        "release_artifact_ref": { "type": "string", "minLength": 3 },
        "pre_release_smoke_ref": { "type": "string", "minLength": 3 },
        "approval_rule_ref": { "type": "string", "minLength": 3 }
      },
      "additionalProperties": false
    },
    "rollback_path": {
      "type": "object",
      "required": ["rollback_owner", "rollback_trigger", "rollback_procedure_ref", "rollback_validation_ref", "max_time_to_restore"],
      "properties": {
        "rollback_owner": { "type": "string", "minLength": 3 },
        "rollback_trigger": { "type": "string", "minLength": 3 },
        "rollback_procedure_ref": { "type": "string", "minLength": 3 },
        "rollback_validation_ref": { "type": "string", "minLength": 3 },
        "max_time_to_restore": { "type": "string", "minLength": 3 }
      },
      "additionalProperties": false
    },
    "health_checks": {
      "type": "array",
      "minItems": 1,
      "items": {
        "type": "object",
        "required": ["check_id", "signal_ref", "pass_condition", "owner", "cadence"],
        "properties": {
          "check_id": { "type": "string", "minLength": 3 },
          "signal_ref": { "type": "string", "minLength": 3 },
          "pass_condition": { "type": "string", "minLength": 3 },
          "owner": { "type": "string", "minLength": 3 },
          "cadence": { "type": "string", "minLength": 3 }
        },
        "additionalProperties": false
      }
    },
    "monitoring_signals": {
      "type": "array",
      "minItems": 1,
      "items": {
        "type": "object",
        "required": ["signal_id", "source_ref", "alert_condition", "owner", "evidence_ref"],
        "properties": {
          "signal_id": { "type": "string", "minLength": 3 },
          "source_ref": { "type": "string", "minLength": 3 },
          "alert_condition": { "type": "string", "minLength": 3 },
          "owner": { "type": "string", "minLength": 3 },
          "evidence_ref": { "type": "string", "minLength": 3 }
        },
        "additionalProperties": false
      }
    },
    "release_approval_rule": {
      "type": "object",
      "required": ["authority", "required_before", "human_gate_required", "evidence_ref"],
      "properties": {
        "authority": { "type": "string", "minLength": 3 },
        "required_before": { "enum": ["release_candidate", "production_release", "mainnet_release"] },
        "human_gate_required": { "type": "boolean" },
        "evidence_ref": { "type": "string", "minLength": 3 }
      },
      "additionalProperties": false
    },
    "support_handoff": {
      "type": "object",
      "required": ["support_owner", "support_channel_ref", "escalation_policy_ref", "response_slo", "handoff_evidence_ref"],
      "properties": {
        "support_owner": { "type": "string", "minLength": 3 },
        "support_channel_ref": { "type": "string", "minLength": 3 },
        "escalation_policy_ref": { "type": "string", "minLength": 3 },
        "response_slo": { "type": "string", "minLength": 3 },
        "handoff_evidence_ref": { "type": "string", "minLength": 3 }
      },
      "additionalProperties": false
    },
    "incident_owner": {
      "type": "string",
      "minLength": 3
    },
    "production_promotion_ladder_ref": {
      "type": "string",
      "minLength": 3
    },
    "evidence_refs": {
      "type": "array",
      "minItems": 1,
      "items": { "type": "string", "minLength": 3 }
    }
  },
  "additionalProperties": false
}
