{
  "$schema": "https://overkill-factory.dev/schemas/production-readiness-plan.schema.json",
  "gate_enforcement": "production",
  "release_owner": "release-ops-worker",
  "release_path": {
    "release_channel": "staged-public-release",
    "release_artifact_ref": "templates/production-readiness-plan.json",
    "pre_release_smoke_ref": "scripts/release_integration_preflight.py",
    "approval_rule_ref": "templates/production-promotion-ladder.json"
  },
  "rollback_path": {
    "rollback_owner": "release-ops-worker",
    "rollback_trigger": "Any blocking regression in validation, public safety, secret safety or support readiness.",
    "rollback_procedure_ref": "docs/en/10-local-validation.md",
    "rollback_validation_ref": "scripts/release_integration_preflight.py",
    "max_time_to_restore": "bounded to the release owner runbook"
  },
  "health_checks": [
    {
      "check_id": "release-smoke",
      "signal_ref": "scripts/release_integration_preflight.py",
      "pass_condition": "preflight result is PASS",
      "owner": "release-ops-worker",
      "cadence": "before every release"
    }
  ],
  "monitoring_signals": [
    {
      "signal_id": "public-safety",
      "source_ref": "scripts/public_safety_scan.py",
      "alert_condition": "public safety scan fails",
      "owner": "release-ops-worker",
      "evidence_ref": "scripts/public_safety_scan.py"
    }
  ],
  "release_approval_rule": {
    "authority": "human-gate-clerk",
    "required_before": "production_release",
    "human_gate_required": true,
    "evidence_ref": "templates/human-gate-record.json"
  },
  "support_handoff": {
    "support_owner": "release-ops-worker",
    "support_channel_ref": "external:operator-support-route",
    "escalation_policy_ref": "templates/incident-support-plan.json",
    "response_slo": "owner acknowledges blocking release incidents before promotion continues",
    "handoff_evidence_ref": "templates/incident-support-plan.json"
  },
  "incident_owner": "release-ops-worker",
  "production_promotion_ladder_ref": "templates/production-promotion-ladder.json",
  "evidence_refs": [
    "templates/production-readiness-plan.json",
    "templates/production-promotion-ladder.json"
  ]
}
